{
  "analysisVersion": "1.3.0",
  "generatedAt": "2026-10-29T00:50:33.515Z",
  "dataset": {
    "datasetId": "2027-aytc-jurassic-park",
    "schemaVersion": "2.0.0",
    "generatedAt": "2026-10-29T00:50:32.000Z",
    "collectionStage": "step_1_complete",
    "finalReportReady": true
  },
  "team": {
    "name": "AYTC-Jurassic (Park)",
    "section": "Mixed 18+ Pacific NW X 7.0",
    "district": null,
    "league": "2027 Mixed 18 & Over (A)",
    "level": "7.0",
    "gender": "Mixed",
    "season": 2027,
    "nationalsRepresentative": false,
    "reportedTotals": {
      "teamWins": 0,
      "teamLosses": 2,
      "courtWins": 1,
      "courtLosses": 5
    },
    "leagueFormat": "mixed"
  },
  "summary": {
    "rosterSize": 17,
    "matches": 2,
    "teamRecord": {
      "wins": 0,
      "losses": 2,
      "ties": 0,
      "unknown": 0,
      "decisions": 2,
      "winRate": 0
    },
    "courtRecord": {
      "wins": 1,
      "losses": 5,
      "ties": 0,
      "unknown": 0,
      "decisions": 6,
      "winRate": 0.1667
    },
    "phases": {
      "local": {
        "matches": 2,
        "teamRecord": {
          "wins": 0,
          "losses": 2,
          "ties": 0,
          "unknown": 0,
          "decisions": 2,
          "winRate": 0
        },
        "courtRecord": {
          "wins": 1,
          "losses": 5,
          "ties": 0,
          "unknown": 0,
          "decisions": 6,
          "winRate": 0.1667
        }
      }
    }
  },
  "eligibility": {
    "scope": "local",
    "label": "Local",
    "rules": {
      "computerRatedMatches": 0,
      "selfRatedOrAppealedMatches": 0,
      "computerRatedDefaultReceivedMayCount": 1,
      "selfRatedOrAppealedDefaultsCount": false,
      "disqualifiedPlayersAvailable": false
    },
    "summary": {
      "rosterSize": 17,
      "eligible": 17,
      "ineligible": 0,
      "unavailable": 0,
      "unknown": 0
    },
    "dataQualityIssues": [],
    "players": [
      {
        "name": "Ha Yong Lee",
        "ntrpLevel": "4.0",
        "ntrpType": "C",
        "ratingCategory": "computer_rated",
        "appearanceSource": "roster",
        "actualMatches": 1,
        "defaultsReceived": 0,
        "sourceAppearances": {
          "actual": 1,
          "defaultsReceived": 0
        },
        "matchLedgerAppearances": {
          "actual": 1,
          "defaultsReceived": 0
        },
        "countedDefaults": 0,
        "countedMatches": 1,
        "matchesRequired": 0,
        "matchesNeeded": 0,
        "sectionalsAppearances": 0,
        "dr": 3.87,
        "utr": {
          "singles": {
            "value": 6.18,
            "exactValue": 6.18,
            "display": "6.18",
            "status": "Rated",
            "reliability": 100
          },
          "doubles": {
            "value": 6.4,
            "exactValue": 6.4,
            "display": "6.40",
            "status": "Rated",
            "reliability": 100
          }
        },
        "local": {
          "singles": {
            "appearances": 0,
            "record": {
              "wins": 0,
              "losses": 0,
              "ties": 0,
              "unknown": 0,
              "decisions": 0,
              "winRate": null
            }
          },
          "doubles": {
            "appearances": 1,
            "record": {
              "wins": 0,
              "losses": 1,
              "ties": 0,
              "unknown": 0,
              "decisions": 1,
              "winRate": 0
            }
          },
          "appearances": 1
        },
        "postseasonAppearances": 0,
        "courtUsage": [
          {
            "court": "D2",
            "appearances": 1
          }
        ],
        "localCourtUsage": [
          {
            "court": "D2",
            "appearances": 1
          }
        ],
        "postseasonCourtUsage": [],
        "primaryPartner": {
          "name": "Seungyeon Huh",
          "appearances": 1,
          "record": {
            "wins": 0,
            "losses": 1,
            "ties": 0,
            "unknown": 0,
            "decisions": 1,
            "winRate": 0
          }
        },
        "singlesUpsets": {
          "higherDrWins": 0,
          "higherUtrWins": 0
        },
        "sourceLikelyRole": null,
        "sourceNote": null,
        "status": "eligible",
        "role": "Doubles Depth (D2)",
        "standoutNote": "Highest eligible DR (3.87); Roster-high 1 local doubles appearance, mainly D2 (0–1)."
      },
      {
        "name": "Edward Park",
        "ntrpLevel": "4.0",
        "ntrpType": "unknown",
        "ratingCategory": "unknown",
        "appearanceSource": "roster",
        "actualMatches": 1,
        "defaultsReceived": 0,
        "sourceAppearances": {
          "actual": 1,
          "defaultsReceived": 0
        },
        "matchLedgerAppearances": {
          "actual": 1,
          "defaultsReceived": 0
        },
        "countedDefaults": 0,
        "countedMatches": 1,
        "matchesRequired": 0,
        "matchesNeeded": 0,
        "sectionalsAppearances": 0,
        "dr": 3.51,
        "utr": {
          "singles": {
            "value": null,
            "exactValue": null,
            "display": "NR",
            "status": "Unrated",
            "reliability": 0
          },
          "doubles": {
            "value": 4.8,
            "exactValue": 4.8,
            "display": "4.80",
            "status": "Rated",
            "reliability": 100
          }
        },
        "local": {
          "singles": {
            "appearances": 0,
            "record": {
              "wins": 0,
              "losses": 0,
              "ties": 0,
              "unknown": 0,
              "decisions": 0,
              "winRate": null
            }
          },
          "doubles": {
            "appearances": 1,
            "record": {
              "wins": 1,
              "losses": 0,
              "ties": 0,
              "unknown": 0,
              "decisions": 1,
              "winRate": 1
            }
          },
          "appearances": 1
        },
        "postseasonAppearances": 0,
        "courtUsage": [
          {
            "court": "D1",
            "appearances": 1
          }
        ],
        "localCourtUsage": [
          {
            "court": "D1",
            "appearances": 1
          }
        ],
        "postseasonCourtUsage": [],
        "primaryPartner": {
          "name": "Jiyoung Shin",
          "appearances": 1,
          "record": {
            "wins": 1,
            "losses": 0,
            "ties": 0,
            "unknown": 0,
            "decisions": 1,
            "winRate": 1
          }
        },
        "singlesUpsets": {
          "higherDrWins": 0,
          "higherUtrWins": 0
        },
        "sourceLikelyRole": null,
        "sourceNote": null,
        "status": "eligible",
        "role": "Doubles Depth (D1)",
        "standoutNote": "Roster-high 1 local doubles appearance, mainly D1 (1–0)."
      },
      {
        "name": "Dongchul Lee",
        "ntrpLevel": "3.5",
        "ntrpType": "S",
        "ratingCategory": "self_rated_or_appealed",
        "appearanceSource": "roster",
        "actualMatches": 1,
        "defaultsReceived": 0,
        "sourceAppearances": {
          "actual": 1,
          "defaultsReceived": 0
        },
        "matchLedgerAppearances": {
          "actual": 1,
          "defaultsReceived": 0
        },
        "countedDefaults": 0,
        "countedMatches": 1,
        "matchesRequired": 0,
        "matchesNeeded": 0,
        "sectionalsAppearances": 0,
        "dr": 3.51,
        "utr": {
          "singles": {
            "value": null,
            "exactValue": null,
            "display": "NR",
            "status": "Unrated",
            "reliability": 0
          },
          "doubles": {
            "value": 4.96,
            "exactValue": 4.96,
            "display": "4.96",
            "status": "Projected",
            "reliability": 4
          }
        },
        "local": {
          "singles": {
            "appearances": 0,
            "record": {
              "wins": 0,
              "losses": 0,
              "ties": 0,
              "unknown": 0,
              "decisions": 0,
              "winRate": null
            }
          },
          "doubles": {
            "appearances": 1,
            "record": {
              "wins": 0,
              "losses": 1,
              "ties": 0,
              "unknown": 0,
              "decisions": 1,
              "winRate": 0
            }
          },
          "appearances": 1
        },
        "postseasonAppearances": 0,
        "courtUsage": [
          {
            "court": "D1",
            "appearances": 1
          }
        ],
        "localCourtUsage": [
          {
            "court": "D1",
            "appearances": 1
          }
        ],
        "postseasonCourtUsage": [],
        "primaryPartner": {
          "name": "Elise Wong",
          "appearances": 1,
          "record": {
            "wins": 0,
            "losses": 1,
            "ties": 0,
            "unknown": 0,
            "decisions": 1,
            "winRate": 0
          }
        },
        "singlesUpsets": {
          "higherDrWins": 0,
          "higherUtrWins": 0
        },
        "sourceLikelyRole": null,
        "sourceNote": null,
        "status": "eligible",
        "role": "Doubles Depth (D1)",
        "standoutNote": "Roster-high 1 local doubles appearance, mainly D1 (0–1)."
      },
      {
        "name": "Brian Ko",
        "ntrpLevel": "3.5",
        "ntrpType": "C",
        "ratingCategory": "computer_rated",
        "appearanceSource": "roster",
        "actualMatches": 0,
        "defaultsReceived": 0,
        "sourceAppearances": {
          "actual": 0,
          "defaultsReceived": 0
        },
        "matchLedgerAppearances": {
          "actual": 0,
          "defaultsReceived": 0
        },
        "countedDefaults": 0,
        "countedMatches": 0,